{
  "schema_version": "1.0.0",
  "artifact_type": "public_national_lifecycle_verification_tranche_summary",
  "artifact_version": "2026.08.31",
  "generated_at": "2026-09-01T07:00:00Z",
  "tranche_id": "trn_lifecycle_national_4_20260831",
  "policy_id": "pol_lifecycle_national_20260831",
  "input_dataset_ids": [
    "im3_lifecycle_national_tranche_3_20260831"
  ],
  "counts": {
    "active_canonical_facility_count": 1337,
    "initial_tranche_facility_count": 48,
    "reviewed_facility_count": 8,
    "tranche_verified_facility_count": 5,
    "cumulative_verified_facility_count": 36,
    "in_research_facility_count": 17,
    "needs_review_facility_count": 3,
    "remaining_queue_facility_count": 16,
    "unknown_status_facility_count": 1301,
    "source_count": 17,
    "claim_count": 24,
    "event_count": 3,
    "observation_count": 3
  },
  "reviewed_by_region": {
    "Midwest": 2,
    "Northeast": 2,
    "South": 2,
    "West": 2
  },
  "notices": [
    "National initial-tranche ranks twenty-five through thirty-two are reviewed: five resolve operational and three remain unresolved.",
    "Lumen Norristown and CyrusOne CIN3 lack a current policy-compliant exact-building operator or official lifecycle record.",
    "QTS DAL10 remains unresolved because current evidence identifies the six-building Irving campus but not the mapped building.",
    "Sixteen facilities remain queued in the balanced initial national tranche."
  ]
}
