{
  "schema_version": "1.0.0",
  "artifact_type": "public_national_lifecycle_verification_tranche_summary",
  "artifact_version": "2026.08.31",
  "generated_at": "2026-09-02T01:00:00Z",
  "tranche_id": "trn_lifecycle_national_2_20260831",
  "policy_id": "pol_lifecycle_national_20260831",
  "input_dataset_ids": [
    "im3_lifecycle_national_tranche_1_20260831"
  ],
  "counts": {
    "active_canonical_facility_count": 1337,
    "initial_tranche_facility_count": 48,
    "reviewed_facility_count": 8,
    "tranche_verified_facility_count": 6,
    "cumulative_verified_facility_count": 24,
    "in_research_facility_count": 13,
    "needs_review_facility_count": 3,
    "remaining_queue_facility_count": 32,
    "unknown_status_facility_count": 1313,
    "source_count": 12,
    "claim_count": 22,
    "event_count": 1,
    "observation_count": 5
  },
  "reviewed_by_region": {
    "Midwest": 2,
    "Northeast": 2,
    "South": 2,
    "West": 2
  },
  "notices": [
    "National initial-tranche ranks nine through sixteen are reviewed: six resolve operational and two remain unresolved.",
    "CMH56 and CMH59 lack a policy-compliant exact-building match from an official or first-party source.",
    "Cyxtera is retained as a historical TPA1 seed label; Csquare publishes the current facility record.",
    "Thirty-two facilities remain queued in the balanced initial national tranche."
  ]
}
