{
  "schema_version": "1.0.0",
  "artifact_type": "public_national_lifecycle_verification_tranche_summary",
  "artifact_version": "2026.08.31",
  "generated_at": "2026-09-02T01:30:00Z",
  "tranche_id": "trn_lifecycle_national_5_20260831",
  "policy_id": "pol_lifecycle_national_20260831",
  "input_dataset_ids": [
    "im3_lifecycle_national_tranche_4_20260831"
  ],
  "counts": {
    "active_canonical_facility_count": 1337,
    "initial_tranche_facility_count": 48,
    "reviewed_facility_count": 8,
    "tranche_verified_facility_count": 5,
    "cumulative_verified_facility_count": 41,
    "in_research_facility_count": 19,
    "needs_review_facility_count": 4,
    "remaining_queue_facility_count": 8,
    "unknown_status_facility_count": 1296,
    "source_count": 17,
    "claim_count": 25,
    "event_count": 3,
    "observation_count": 5
  },
  "reviewed_by_region": {
    "Midwest": 2,
    "Northeast": 2,
    "South": 2,
    "West": 2
  },
  "notices": [
    "National initial-tranche ranks thirty-three through forty are reviewed: five resolve operational, two remain unresolved, and one is disputed.",
    "Google Papillion and the Union Pacific Jack Koraleski center lack policy-compliant exact-building evidence.",
    "The mapped Microsoft Data Center 1 point conflicts with Prince William County's exact-coordinate Corscale GCDC1 record.",
    "Eight facilities remain queued in the balanced initial national tranche."
  ]
}
