{
  "schema_version": "1.0.0",
  "artifact_type": "public_national_lifecycle_verification_tranche_summary",
  "artifact_version": "2026.08.31",
  "generated_at": "2026-09-02T00:00:00Z",
  "tranche_id": "trn_lifecycle_national_3_20260831",
  "policy_id": "pol_lifecycle_national_20260831",
  "input_dataset_ids": [
    "im3_lifecycle_national_tranche_2_20260831"
  ],
  "counts": {
    "active_canonical_facility_count": 1337,
    "initial_tranche_facility_count": 48,
    "reviewed_facility_count": 8,
    "tranche_verified_facility_count": 7,
    "cumulative_verified_facility_count": 31,
    "in_research_facility_count": 14,
    "needs_review_facility_count": 3,
    "remaining_queue_facility_count": 24,
    "unknown_status_facility_count": 1306,
    "source_count": 18,
    "claim_count": 26,
    "event_count": 3,
    "observation_count": 7
  },
  "reviewed_by_region": {
    "Midwest": 2,
    "Northeast": 2,
    "South": 2,
    "West": 2
  },
  "notices": [
    "National initial-tranche ranks seventeen through twenty-four are reviewed: seven resolve operational and one remains unresolved.",
    "SAP's current Colorado Springs market record does not independently map the COS02 code to the mapped building.",
    "Oxford Networks and DataSite Atlanta are retained as historical seed labels; FirstLight and CoreSite publish the current facility records.",
    "Twenty-four facilities remain queued in the balanced initial national tranche."
  ]
}
